{
  "$schema": "https://json-schema.org/draft/2020-12/schema",
  "$id": "urn:system-inspector:query:1",
  "title": "Historical query request",
  "type": "object",
  "properties": {
    "process_ids": {
      "type": "array",
      "items": {
        "type": "string",
        "pattern": "^[A-Za-z0-9][A-Za-z0-9_.:-]{0,127}$"
      },
      "minItems": 1,
      "maxItems": 200
    },
    "from": {
      "type": "string",
      "pattern": "^\\d{4}-\\d{2}-\\d{2}T\\d{2}:\\d{2}:\\d{2}\\.\\d{6}Z$"
    },
    "to": {
      "type": "string",
      "pattern": "^\\d{4}-\\d{2}-\\d{2}T\\d{2}:\\d{2}:\\d{2}\\.\\d{6}Z$"
    },
    "filter": {
      "type": "object",
      "properties": {
        "include": {
          "type": "array",
          "items": {
            "type": "string",
            "maxLength": 512
          },
          "minItems": 0,
          "maxItems": 20
        },
        "include_mode": {
          "enum": [
            "any",
            "all"
          ]
        },
        "exclude": {
          "type": "array",
          "items": {
            "type": "string",
            "maxLength": 512
          },
          "minItems": 0,
          "maxItems": 20
        },
        "case_sensitive": {
          "type": "boolean"
        }
      },
      "required": [
        "include",
        "include_mode",
        "exclude",
        "case_sensitive"
      ],
      "additionalProperties": false
    },
    "per_process_filters": {
      "type": "object",
      "additionalProperties": {
        "type": "object",
        "properties": {
          "include": {
            "type": "array",
            "items": {
              "type": "string",
              "maxLength": 512
            },
            "minItems": 0,
            "maxItems": 20
          },
          "include_mode": {
            "enum": [
              "any",
              "all"
            ]
          },
          "exclude": {
            "type": "array",
            "items": {
              "type": "string",
              "maxLength": 512
            },
            "minItems": 0,
            "maxItems": 20
          },
          "case_sensitive": {
            "type": "boolean"
          }
        },
        "required": [
          "include",
          "include_mode",
          "exclude",
          "case_sensitive"
        ],
        "additionalProperties": false
      }
    },
    "limit": {
      "type": "integer",
      "minimum": 1,
      "maximum": 1000
    },
    "cursor": {
      "type": [
        "string",
        "null"
      ]
    },
    "lane": {
      "enum": [
        "events",
        "diagnostic"
      ],
      "default": "events",
      "description": "Unknown timestamp records remain diagnostic and never receive an invented time."
    }
  },
  "required": [
    "process_ids",
    "from",
    "to",
    "filter",
    "per_process_filters",
    "limit",
    "cursor"
  ],
  "additionalProperties": false
}
